{
  "$schema": "https://json-schema.org/draft/2020-12/schema",
  "$id": "https://github.com/MoltyCel/did-moltrust-conformance/schema/vector-schema.json",
  "title": "did:moltrust Conformance Vector",
  "description": "One executable check against the published did:moltrust method specification. The specification is HTML at https://moltrust.ch/did-method-spec.html; section_ref names the section a vector is derived from, so a reader can go from a failure to the sentence it contradicts.",
  "type": "object",
  "required": ["id", "name", "description", "section_ref", "check", "input", "expected", "rationale"],
  "additionalProperties": false,
  "properties": {
    "id": {
      "type": "string",
      "pattern": "^did-(syntax|derivation|resolve|bridge|deployment|lookup)-[a-z0-9-]{3,72}$",
      "description": "Derived from the check and the name, never from the position. A positional id changes when an unrelated vector is inserted, which invalidates every report and register entry that names it."
    },
    "name": { "type": "string", "minLength": 1 },
    "description": { "type": "string", "minLength": 1 },
    "section_ref": {
      "type": "string",
      "minLength": 1,
      "description": "Section of the method specification, e.g. \"2.2\" or \"4.2\"."
    },
    "check": {
      "type": "string",
      "enum": ["syntax", "derivation", "resolve", "bridge", "deployment", "lookup"],
      "description": "syntax = the identifier string alone decides, no network. derivation = the identifier must follow from a public key. resolve = a live request to the registry or the Universal Resolver driver. bridge = section 6, the cross-ecosystem bridge. deployment = whether a running service behaves like the version it reports. lookup = a read endpoint that takes a DID in its path applies the section 2.2 syntax."
    },
    "target": {
      "type": "string",
      "enum": ["none", "api", "driver"],
      "default": "none",
      "description": "What answers. 'none' for a check that needs no service. A vector names exactly one target, so a failure cannot be excused by a register entry that belongs to the other one."
    },
    "path_form": {
      "type": "string",
      "enum": ["plain", "encoded"],
      "default": "plain",
      "description": "How the DID is written into the request path. 'plain' leaves the colons as they are, which is what a Universal Resolver sends: HttpDriver inserts the $1 placeholder verbatim. 'encoded' percent-encodes them, which RFC 3986 makes an equivalent address and which the $2 and options paths of the same driver produce."
    },
    "input": {
      "type": "object",
      "additionalProperties": false,
      "properties": {
        "did": { "type": "string" },
        "public_key_hex": {
          "type": "string",
          "pattern": "^[0-9a-f]{64}$",
          "description": "Ed25519 public key, 32 bytes as lowercase hex, for a derivation vector."
        },
        "external_did": { "type": "string" },
        "path": {
          "type": "string",
          "pattern": "^/[^ ]*\\{did\\}[^ ]*$",
          "description": "For a lookup vector: the endpoint path, with {did} where the DID goes."
        },
        "body": { "type": "object" }
      }
    },
    "expected": {
      "type": "object",
      "required": ["result"],
      "additionalProperties": false,
      "properties": {
        "result": {
          "type": "string",
          "enum": ["CONFORMS", "NOT_DERIVED", "ASSIGNED", "RESOLVES", "NOT_FOUND", "INVALID_DID", "UNSUPPORTED_METHOD"],
          "description": "CONFORMS for a syntax or derivation vector that should hold. NOT_DERIVED for a derivation vector whose identifier must not recompute from its key. ASSIGNED for an identifier issued before v0.2 (rule assigned-opaque): it resolves and is not reported as derived. The other four are resolution outcomes."
        },
        "http_status": { "type": ["integer", "null"], "minimum": 100, "maximum": 599 },
        "reason_code": {
          "type": ["string", "null"],
          "description": "The machine-readable code the answer must carry: invalid_did, unsupported_method and, for a resolve miss, the type URL https://www.w3.org/ns/did#NOT_FOUND for the API; invalidDid, notFound, methodNotSupported for the driver."
        }
      }
    },
    "rationale": {
      "type": "string",
      "minLength": 10,
      "description": "Why the specification requires this outcome. A failure should be readable without opening the spec."
    },
    "expected_history": {
      "type": "array",
      "description": "Expected values this vector carried before, oldest first, each with the date it was replaced and why. Kept so a report quoting an old expectation stays traceable. The runner does not read it.",
      "items": {
        "type": "object",
        "required": ["replaced", "expected", "why"],
        "additionalProperties": false,
        "properties": {
          "replaced": { "type": "string", "pattern": "^[0-9]{4}-[0-9]{2}-[0-9]{2}$" },
          "expected": {
            "type": "object",
            "required": ["result"],
            "additionalProperties": false,
            "properties": {
              "result": { "type": "string" },
              "http_status": { "type": ["integer", "null"], "minimum": 100, "maximum": 599 },
              "reason_code": { "type": ["string", "null"] }
            }
          },
          "why": { "type": "string", "minLength": 10 }
        }
      }
    },
    "known_deviation": {
      "type": "string",
      "description": "Key into deviations.json. Present when the vector is expected to fail today; the runner reports it and does not fail the run."
    }
  }
}
