{
  "name": "well-formed identifier: all zero, still sixteen hex",
  "description": "did:moltrust:0000000000000000 matches [0-9a-f]{16}.",
  "section_ref": "2.2",
  "check": "syntax",
  "target": "none",
  "input": {
    "did": "did:moltrust:0000000000000000"
  },
  "expected": {
    "result": "CONFORMS"
  },
  "rationale": "Section 2.2 defines method-specific-id := [0-9a-f]{16}. This identifier is all zero, still sixteen hex and therefore conforms.",
  "id": "did-syntax-well-formed-identifier-all-zero-still-si"
}
