{
  "name": "a registered identifier resolves to a DID document [driver]",
  "description": "did:moltrust:d34ed796a4dc4698 against the driver.",
  "section_ref": "4.2",
  "check": "resolve",
  "target": "driver",
  "input": {
    "did": "did:moltrust:d34ed796a4dc4698"
  },
  "expected": {
    "result": "RESOLVES",
    "http_status": 200,
    "reason_code": null
  },
  "rationale": "Section 4.2 describes resolution as a GET that returns the DID document. Section 3.1 uses this identifier as its example.",
  "id": "did-resolve-a-registered-identifier-resolves-to-a-di-driver"
}
