{
  "name": "the ext_ prefix is not a did:moltrust identifier [driver]",
  "description": "did:moltrust:ext_516a656bafa39e5c against the driver.",
  "section_ref": "2.2",
  "check": "resolve",
  "target": "driver",
  "input": {
    "did": "did:moltrust:ext_516a656bafa39e5c"
  },
  "expected": {
    "result": "INVALID_DID",
    "http_status": 400,
    "reason_code": "invalidDid"
  },
  "rationale": "Section 2.2 defines no prefix, and section 6 describes the bridge without one. Eighteen of the nineteen bridge rows map to a conformant identifier.",
  "known_deviation": "deployment::the public resolver runs a third codebase",
  "id": "did-vector-026"
}
