{
  "name": "the identifier follows from the public key",
  "description": "Section 2.2 does not only give a shape, it says where the identifier comes from: the first 8 bytes of the SHA-256 hash of the agent's Ed25519 public key at registration time.",
  "section_ref": "2.2",
  "check": "derivation",
  "target": "none",
  "input": {
    "public_key_hex": "3b6a27bcceb6a42d62a3a8d02a6f0d73653215771de243a63ac048a18b59da29",
    "did": "did:moltrust:139e3940e64b5491"
  },
  "expected": {
    "result": "CONFORMS"
  },
  "rationale": "SHA-256 over the 32 raw key bytes, first 8 bytes as lowercase hex. This vector checks the arithmetic itself and is the reference a registered DID is compared against.",
  "id": "did-derivation-the-identifier-follows-from-the-public-k"
}
