{
  "name": "the other pre-convention identifier behaves the same [api]",
  "description": "did:moltrust:vcone against the api.",
  "section_ref": "2.2",
  "check": "resolve",
  "target": "api",
  "input": {
    "did": "did:moltrust:vcone"
  },
  "expected": {
    "result": "INVALID_DID",
    "http_status": 400,
    "reason_code": "invalid_did"
  },
  "rationale": "Two rows predate the 16-hex convention. Both must answer the same way, so neither becomes a special case.",
  "id": "did-resolve-the-other-pre-convention-identifier-beha-api"
}
