{
  "name": "a percent-encoded DID is the same address [driver]",
  "description": "did%3Amoltrust%3Ad34ed796a4dc4698 must answer exactly as the plain form does.",
  "section_ref": "4.2",
  "check": "resolve",
  "target": "driver",
  "path_form": "encoded",
  "input": {
    "did": "did:moltrust:d34ed796a4dc4698"
  },
  "expected": {
    "result": "RESOLVES",
    "http_status": 200,
    "reason_code": null
  },
  "rationale": "RFC 3986 allows a colon unencoded in a path segment, and percent-encoding it yields an equivalent URI. On 2026-10-06 the driver answered the plain form and gave the encoded one a plain-text 404 with no resolution metadata at all, because a Hono route pattern matched the raw path. HttpDriver.java sends the plain form for a $1 placeholder and the encoded form for $2 or when resolution options are present, so both reach a driver in practice.",
  "id": "did-resolve-a-percent-encoded-did-is-the-same-addres-driver-encoded"
}
