{
  "name": "well-formed identifier: sixteen lowercase hex characters",
  "description": "did:moltrust:0123456789abcdef matches [0-9a-f]{16}.",
  "section_ref": "2.2",
  "check": "syntax",
  "target": "none",
  "input": {
    "did": "did:moltrust:0123456789abcdef"
  },
  "expected": {
    "result": "CONFORMS"
  },
  "rationale": "Section 2.2 defines method-specific-id := [0-9a-f]{16}. This identifier is sixteen lowercase hex characters and therefore conforms.",
  "id": "did-syntax-well-formed-identifier-sixteen-lowercase"
}
