{
  "name": "a foreign method is refused as such: did:key",
  "description": "did:key:z6MkhaXgBZDvotDkL5257faiz is not a did:moltrust identifier.",
  "section_ref": "4.2",
  "check": "resolve",
  "target": "api",
  "input": {
    "did": "did:key:z6MkhaXgBZDvotDkL5257faiz"
  },
  "expected": {
    "result": "UNSUPPORTED_METHOD",
    "http_status": 400,
    "reason_code": "unsupported_method"
  },
  "rationale": "An unknown method and a malformed identifier of a known method are different problems and must not share an answer.",
  "id": "did-vector-028"
}
